{
  "id": "cf-meta-llama-3-8b-instruct",
  "type": "model-card",
  "version": "1.0.0",
  "name": "Llama 3 8B Instruct",
  "description": "State-of-the-art performance on industry benchmarks with improved reasoning capabilities.",
  "vendor": "Meta",
  "provider": "Cloudflare Workers AI",
  "provider_id": "@cf/meta/llama-3-8b-instruct",
  "family": "Llama 3",
  "category": "text-generation",
  "capabilities": [],
  "planned_deprecation": true,
  "provenance": {
    "source": "https://developers.cloudflare.com/workers-ai/models/",
    "addedBy": "convergent-systems-co",
    "addedAt": "2026-05-25T15:39:11Z"
  }
}
