{
  "id": "cf-black-forest-labs-flux-2-klein-9b",
  "type": "model-card",
  "version": "1.0.0",
  "name": "FLUX 2 Klein 9B",
  "description": "Ultra-fast distilled image model with enhanced quality; unifies image generation and editing in a single model.",
  "vendor": "Black Forest Labs",
  "provider": "Cloudflare Workers AI",
  "provider_id": "@cf/black-forest-labs/flux-2-klein-9b",
  "family": "FLUX 2",
  "category": "text-to-image",
  "capabilities": [],
  "planned_deprecation": false,
  "provenance": {
    "source": "https://developers.cloudflare.com/workers-ai/models/",
    "addedBy": "convergent-systems-co",
    "addedAt": "2026-05-25T15:39:11Z"
  }
}
