{
  "id": "cf-huggingface-distilbert-sst-2-int8",
  "type": "model-card",
  "version": "1.0.0",
  "name": "DistilBERT SST-2 INT8",
  "description": "Distilled BERT model fine-tuned on SST-2 for sentiment classification.",
  "vendor": "HuggingFace",
  "provider": "Cloudflare Workers AI",
  "provider_id": "@cf/huggingface/distilbert-sst-2-int8",
  "family": "DistilBERT",
  "category": "text-classification",
  "capabilities": [],
  "planned_deprecation": false,
  "provenance": {
    "source": "https://developers.cloudflare.com/workers-ai/models/",
    "addedBy": "convergent-systems-co",
    "addedAt": "2026-05-25T15:39:11Z"
  }
}
