{
  "id": "structured-output",
  "type": "capability",
  "version": "1.0.0",
  "name": "Structured Output",
  "description": "Guarantees model output conforms to a caller-supplied JSON Schema or equivalent structure, stronger than JSON mode alone.",
  "aliases": [
    "json-mode",
    "json-schema-output"
  ],
  "provenance": {
    "source": "https://developers.cloudflare.com/workers-ai/models/",
    "addedBy": "convergent-systems-co",
    "addedAt": "2026-05-25T00:00:00Z"
  }
}
