{
  "id": "cf-google-gemma-3-12b-it",
  "type": "model-card",
  "version": "1.0.0",
  "name": "Gemma 3 12B IT",
  "description": "128K context window model with multilingual support in over 140 languages; handles text and image input.",
  "vendor": "Google",
  "provider": "Cloudflare Workers AI",
  "provider_id": "@cf/google/gemma-3-12b-it",
  "family": "Gemma 3",
  "category": "text-generation",
  "capabilities": [
    "lora"
  ],
  "planned_deprecation": true,
  "context_window": 128000,
  "provenance": {
    "source": "https://developers.cloudflare.com/workers-ai/models/",
    "addedBy": "convergent-systems-co",
    "addedAt": "2026-05-25T15:39:11Z"
  }
}
