{
  "id": "cf-meta-llama-3.1-8b-instruct-awq",
  "type": "model-card",
  "version": "1.0.0",
  "name": "Llama 3.1 8B Instruct AWQ",
  "description": "Quantized (int4) generative text model with 8 billion parameters.",
  "vendor": "Meta",
  "provider": "Cloudflare Workers AI",
  "provider_id": "@cf/meta/llama-3.1-8b-instruct-awq",
  "family": "Llama 3.1",
  "category": "text-generation",
  "capabilities": [],
  "planned_deprecation": true,
  "provenance": {
    "source": "https://developers.cloudflare.com/workers-ai/models/",
    "addedBy": "convergent-systems-co",
    "addedAt": "2026-05-25T15:39:11Z"
  }
}
