{
  "id": "cf-bytedance-stable-diffusion-xl-lightning",
  "type": "model-card",
  "version": "1.0.0",
  "name": "Stable Diffusion XL Lightning",
  "description": "Lightning-fast text-to-image generation model capable of producing high-quality 1024px images in a few steps.",
  "vendor": "ByteDance",
  "provider": "Cloudflare Workers AI",
  "provider_id": "@cf/bytedance/stable-diffusion-xl-lightning",
  "family": "Stable Diffusion XL Lightning",
  "category": "text-to-image",
  "capabilities": [],
  "planned_deprecation": false,
  "provenance": {
    "source": "https://developers.cloudflare.com/workers-ai/models/",
    "addedBy": "convergent-systems-co",
    "addedAt": "2026-05-25T15:39:11Z"
  }
}
