{
  "id": "cf-meta-detr-resnet-50",
  "type": "model-card",
  "version": "1.0.0",
  "name": "DETR ResNet-50",
  "description": "DETection TRansformer model trained end-to-end on COCO 2017 object detection dataset (118k annotated images).",
  "vendor": "Meta",
  "provider": "Cloudflare Workers AI",
  "provider_id": "@cf/meta/detr-resnet-50",
  "family": "DETR",
  "category": "object-detection",
  "capabilities": [],
  "planned_deprecation": false,
  "provenance": {
    "source": "https://developers.cloudflare.com/workers-ai/models/",
    "addedBy": "convergent-systems-co",
    "addedAt": "2026-05-25T15:39:11Z"
  }
}
