{
  "id": "cf-baai-bge-base-en-v1.5",
  "type": "model-card",
  "version": "1.0.0",
  "name": "BGE Base EN v1.5",
  "description": "General embedding base model transforming text into 768-dimensional vectors.",
  "vendor": "BAAI",
  "provider": "Cloudflare Workers AI",
  "provider_id": "@cf/baai/bge-base-en-v1.5",
  "family": "BGE",
  "category": "text-embeddings",
  "capabilities": [
    "batch-processing"
  ],
  "planned_deprecation": false,
  "output_dimensions": 768,
  "provenance": {
    "source": "https://developers.cloudflare.com/workers-ai/models/",
    "addedBy": "convergent-systems-co",
    "addedAt": "2026-05-25T15:39:11Z"
  }
}
